{"schemaVersion":1,"artifactType":"website-context","generatedAt":"2026-08-16T12:00:00Z","contextId":"site-context-20260816T120000Z-abc123def456","contextSha256":"0000000000000000000000000000000000000000000000000000000000000000","projectRoot":"C:/projects/site","projectContentSha256":"1111111111111111111111111111111111111111111111111111111111111111","measurementPlan":{"planId":"measure-example","contentSha256":"2222222222222222222222222222222222222222222222222222222222222222"},"baseline":null,"stack":{"frameworks":["static-html"]},"integrationCandidates":[],"analytics":{},"policy":{},"blockers":[],"limitations":[],"questions":[],"codeExecuted":false,"networkUsed":false}
